Student ID,Unit Number,Comments,Satisfaction
1098,211,"The tips/tricks we are taught by <> are very useful.
Learning how to do invoices.
Learning different design brainstorming techniques that would've been more useful early on in the degree.",5
103,111,modelling and simulating movement,5
1090,270,New lecturer is 1000% more understanding than <>. And helps explain issues where they lie,5
1099,298,"I like the flexibility of doing this online so I can do my readings and assignments at my own pace. The weekly discussion were also good to serve as a weekly reminder to keep me in check of my progress on the assignments, and it was good to get to read other student's discussion contributions.",5
1100,3,It was better run than the first semester unit.,5
1101,115,It is easy to see how this subject relates to the real world. The first two laboratories are pretty good.,5
1094,270,Learning new concepts,5
105,303,The weekly quizzes kept me at least mostly up to date with study and where we're at. The labs are quite interesting.,5
1095,121,"all aspects:
<>
<> system assembly project 
Hydraulics",5
1102,301,Broad background information in water sector.,5
1103,126,Clearly defined requirements for submissions and assignments,5
1104,3,"In the <> semester, we were provided with support from the start of the Semester and <> who took over the workload from <> deserves all the credit he could get. He was very friendly with everyone and was in communication with the students frequently.",5
1105,248,the order that the subjects were placed i felt made it easier for me to study effectively,5
1106,383,The guest lectures on <>,5
1105,143,the pop quiz's,5
1107,211,"I did appreciate the potential for folio worthy projects. I also enjoyed working for a real client, with industry relevance.",5
1108,516,Labs and tutorials as they cement the knowledge gained during lectures,5
107,517,Including many services,5
1109,43,"The actual content of the first few weeks were good, it is an interesting subject and certainly applicable.",5
1110,202,Interesting approach to learning.  Great to deal with young intelligent respectful students.,5
1111,117,<> the ledge,5
1112,121,"Both the first and second portions of the subject were very well presented and provided a lot of good information.
I had found that the <> Project was alot of fun in hindsight despite getting stuck multiple times throughout its development.",5
1113,19,the open book mid semester test. much more like the real world were you are allowed to look at your notes actually encouraged to.,5
1114,326,"the interaction and involvement, particularly tutorials",5
1115,43,The newsletters are good for the organizing everything in this unit.,5
1115,46,We did learn how to write a research paper through this unit.,5
1116,515,"The tutor has a good sense of humour and likable.
The tutor is qualified and highly skilled.
The course content is excellent.
The subject convener has implemented a good learning process.",5
1117,483,The subject as a whole was very interesting and the semester went smoothly. Just fix up exam revision and guidance and it would be a well rounded subject that’s taught very well,5
1118,18,Very informative. A very well like Unit,5
1118,10,The best aspect of this seminar is that is provides more interaction among the students as well as the lecturer,5
112,80,I liked the class not being too big and the support of the teaching,5
1119,138,The flexibility of choosing your own research topic and the variety of lectures provided. the lectures were all very interesting and loved having guest lecturers from different fields come in to speak.,5
1120,328,The discussions that <> facilitated for us. It extended my thinking and listening to me peers gave me much to think about.,5
1121,518,The only good aspects of this course was to find out how little I know and what I need to know for future.,5
1122,42,<>. <> is fantastic too.,5
1123,370,Excellent examples,5
113,458,The itnerview great assighment.,5
1124,88,should get a review of test1 and test2. I think we should get to know what is correct and wrong in test1 and test2.,5
1125,180,"Definitely the idea of peer assessments! It was interesting to see what other students (albeit anonymous to the student markers) thought and wrote, especially for the Journal sections. The essay topic '<>' was actually such an interesting topic too! I actually enjoyed researching the concepts and mass discussions plus debates over this concept!",5
1126,89,"Self learning 

Best subject in Uni! 

every subjects should be like this",5
114,10,"Topics of <> very complex, interesting.",5
113,199,The tute moduels worth <> becuase you could do them in your own time and didnt have to rely on people.,5
1127,368,Great sessions and supporting materials that help me in each stage of the assignments.,5
1127,258,Pushing the boundaries and exploring design elements which are beyond year <>.,5
1125,183,"The presentation was fun albeit nervewrecking at times!
My project supervisors <> and <> were super enthusiast, warm and supportive throughout the entirety of the course. KEEP UP THE GOOD WORK!
Manuscript was challenging, however with teamwork we persevered well!",5
1127,25,Great diverse assignments which challenged me and forced me to delve into the photography world.,5
1128,15,"I thoroughly enjoyed this unit as is, the lecturer is highly engaging and full of great ideas that reflect on his prior industry/academic experiences.",5
1129,286,"Engaging teacher, clearly outlined expectations and information",5
116,519,"The core content was minimal, allowing for all our available time to be invested in writing the thesis",5
1130,437,<> is a pretty inspirational teacher who obviously loves what he teaches,5
1130,343,"I really liked my tutor, so the lab sessions every week were cool. All the stuff that was not making sense made perfect sense when <> explained everything. He has been awesome. Also I liked how <> played music in the lecture break, and he was really helpful.",5
116,486,"The interactivity and class engagement. Most other lectures / tutorials have a one-way, passive approach to teaching, while the learning for this class required everyone to engage. In my opinion, this helped us to develop our understanding of the ethical codes and principles in order to analyse case study with the level of comprehension and analysis required.",5
1131,494,"Lots of support, teacher is always active",5
1132,116,"Material is provided online, very clear to understand as well as keep up. Ability to engage in online discussion is also a great idea allowing exchange of information.",5
119,395,"Giving context to different forms of the <> relations. To this end, examining <> through a historical lens as a process that has evolved over centuries.",5
1132,468,The way the assessments allow for students to apply theory. Also the topics are way to follow.,5
120,460,Assignments were very engaging and electronically made it better,5
1133,151,"Having all tasks visible and available for each grade tier at the start of semester was really good for planning purposes. My favourite part of the unit was getting to design, plan and code my own idea for a program - the unit encourages self-directed learning, something that most uni units could learn from.",5
1134,218,<>. As simple as that,5
119,520,"Apart from the week on '<>' every week was informative and highly interesting. Although I am still somewhat skeptical about the merit of 'theorizing' policy making, it was interesting to see how much effort has gone into framing such a socially contingent aspect of our lives.",5
117,202,My project group was by far the best group I have ever had the pleasure of working with in my time at University.,5
121,521,How relevant the readings were to the reality of teaching,5
1135,296,<> links to real world scenarios helped provide a practical context for the unit.,5
1136,80,Giving feedback every weeks so that we improve our work.,5
1137,522,"It's great to finally get into <> in an <> course, where I would expect a lot more of the course to be <> than what it has been so far. The <> component is exciting and a lot of fun as well.",5
1138,95,"The need to find solutions to current problems faced by organisations 
Researching an unfamiliar market for an organisation",5
1139,426,Easy to follow and the assessment submission is easy to keep up with - makes the animation a little less daunting for first time users of <>.,5
120,523,"constant examples relating to the real world, and the teacher being so interacting with the questions",5
1138,441,Discussing the broad views of life and philosophy with the other students.,5
1140,510,Everything,5
1141,123,The real-world brief with the client,5
1137,472,"I think it's a great idea, and I'd love to learn about the way things move, and analysing action seems to be very important to creating more believable animation.",5
1142,524,I really liked learning about CSR and ethics.,5
1137,280,the freedom to create whatever character you like is nice. Hopefully it's marked with that in mind.,5
1143,117,Teaching and interactivity,5
1136,376,I like the flip class as you can do it in your own time and the discussion board where you can ask anything that you have trouble with.,5
1144,15,The examples and how we can practically use the information provided to us.,5
1145,426,"Learning about After Effects, it was so much fun.",5
1142,299,learning all about the different aspects of Consumer Behaviour and how it influences consumers,5
123,182,Tutorials,5
1146,209,"The balance between <> & <> as lecturer & tutor of the unit, respectively. <> is very straightforward/well-spoken as a lecturer, offering examples of concepts/theories only where relevant and providing clear/concise information. <> is discursive/engaging as a tutor, expanding on the lecture content and proferring the opportunity for students to engage with the material more personally/extensively. As someone who was in back-to-back lectures/tutorials for this unit, I found the balance in methods/delivery engaging and effective.",5
1147,508,I enjoyed the practicality of the assessments.,5
1148,3,I learned a lot from my client and team members. My product will be useful for a resume.,5
1149,194,"I loved working with a real client and testing the knowledge I have learnt throughout my <> degree.  It was good to not have to focus on learning theory and having an exam, and instead applying this knowledge to a client.  I loved doing strategies for the client and developing a marketing plan, where I know I will use these skills in the workplace.  This unit was a great way to finish off my degree, it has given me the confidence that I can in fact contribute strategies and marketing plans to real clients and that I have learnt the knowledge to do so.",5
1150,97,<> passion and care for his students. The assessments weren't terrible and the assistance provided by teaching staff helped a lot.,5
1150,49,"The core concept is great, the first workshop where our teams were formed based on our strengths was FANTASTIC.",5
1142,344,I really enjoyed coming up with the idea and using the blog and Facebook as a platform. Learning how to analyse consumer interests,5
1150,42,"The unit structure, content structure were good, well paced and I never questioned what part of the theory goes where and what applies to what.",5
1150,29,The content was interesting and <> passion and dedication to the students was great and very interesting.,5
1151,95,"- Real world project
- Well-balanced number of assessments",5
1149,202,"I loved this unit, as it incorporated all my learning from my degree into a real world business and working with a real client.  I would recommend this unit to anyone studying a <> degree, as it is more hands on than the <>.  I have gained valuable and knowledge from this unit, that I will use in developing my career and in the workplace",5
123,97,Tutorial classes.,5
127,108,"A place to organise the exhibition properly. A place to prepare a folio if you haven't already done so, and to improve it.",5
124,97,This unit was very good at consolidating what we have learnt in the past. It also allows us to show our knowledge in the assessment structure where we get time and effort to complete this assignment properly.,5
1152,15,Being able to apply the concepts to my current job!,5
1153,1,<> is a great tutor and lecturer,5
1154,510,The unit is interesting and highly engaging.,5
1155,13,The tutorials were short but time was used up efficiently. Help was always available,5
1156,426,Creativity freedom,5
125,168,Enjoying class time. <> made it a very fun environment allowing everyone to push for their best and her feedback was tremendous in our work.,5
1152,116,Having <> as the lecturer because his knowledge and experience very very valuable !,5
124,485,The information about ETF's was very useful and learning ways to value a company.,5
1157,59,"Tutorial class, had a great tutor.",5
1158,94,The weekly lectures from <>. They are so interesting and on topic.,5
1159,525,Was interesting looking at <> and <> from a different perspective.,5
1160,194,Being able to work with a real client. All tutors were really knowledgeable and gave valuable feedback and advice.,5
1161,80,"working with <>, learning what real clients want, learning how to mix innovation with functionality, learning what is expecting in the industry",5
1162,106,Freedom to explore project,5
1160,94,"The amount of freedom we had with content and design, and received solid advice from the teachers and classmates.",5
1158,175,"The project and all the elements involved in creating it, plus being part of a team. Also, I really liked that task 1 was only finding out who to be in a team with. Very happy to have been to change groups.",5
1161,163,Learning about how to print properly in the industry.,5
127,1,"A wrap up of some important info regarding practice before graduating. Although the content could be more relevant to interior design, it is a good summary before graduating.",5
1163,136,"Huge thumbs up that the lectures were recorded, as a <> worker this made my life much easier. I liked the first assignment and the pitch and final assignment because they made me think critically about how I could present business concepts and how I could present myself to businesses as a potential employee.",5
1164,257,Having many different lecturers from different fields in the industry to provide lectures on the topics made understanding certain parts of <> very easy to understand. Looking at other students' contributions and different perspectives on topics gave me a broader understanding on the respective topic.,5
1161,171,learning about managing time and money for clients.,5
130,526,"The classes, when we had them, were very insightful.",5
1165,86,Pracs were great learning experiences.,5
1166,276,The teachers from this unit have been the most helpful throughout my course at uni. I appreciate their ongoing support throughout the unit.  The feedback given individually has really helped me and I've learnt and believe I have improved greatly because of it.,5
128,156,The lectures were fantastic for the most part! I was able to take down plenty of notes which I will be glad to revise in the future.,5
130,279,The personal experiences of the teacher.,5
129,376,<> was quite good with in class help. He explained things quite well.,5
1167,211,The <> project and doing a business case. Attempting a cost analysis of the product was beneficial and insightful,5
142,286,The discussion of the topics in the tutes is really good and makes the subject very interesting. the content is also very useful,5
1168,433,"The open book exam, the content was interesting and applicable. Very accessible for someone like myself who has not studied any law before.",5
136,270,"the test were a good way of doing Revision.
The fact that the test questions were from the tutorial question could mean that the exam might also be from the tutorial questions
The tutor gave good explanation and how to work the question one step at a time.",5
141,274,"The actual content is very good, partnering theory with the labs was really good.",5
134,3,"Doing the <> side of <> I got to collaborate with the <> students and work closely with <>, who was the supervisor and convenor for the <>. The freedom and autonomy provided by the unit was the best aspect.",5
1,162,"weekly in class tasks, really helpful",5
1169,270,"It could be far worse. 
I have learned many new things.",5
134,278,The freedom to pick a topic you wanted to learn and implement it,5
2,286,Content is easy to understand,5
1170,270,"I don't know whether it was by policy or by chance, but I was glad that the vibration question on the exam was one that was done in the tutorial, considering that vibration was the last topic, leaving us less time to do the large number of unit outline questions that weren't done in the tutorial.

My experience of the subject was that I really liked it and would go over the tutes each week making sure I understood them, sometimes do unit outline questions that weren't done in the tutes and watch the lectures again and make notes from them. I was building a good foundation for the subject. But all this stopped when the tests came along, as all of a sudden the focus had to be on getting a good mark each week. I realise that secondary assessments are a part of the way things are done (for other subjects as well) but I really resent the time they take away from actual learning.",5
1171,274,The lectures were clear and concise. The additional help offered by <> and the other teachers was very generous and helpful.,5
133,527,<> wild mind is definitely a plus for the unit. He's a very interesting man to listen to and I could do it all day.,5
1172,19,the online resources,5
140,280,Introduction to new drawing techniques,5
1173,14,"learning CAD.

The course does teach interesting information however sometimes the work required seems counter intuitive to the result.",5
1174,182,<> was a great tutor and explained all topic very concisely keeping to the point and not making the class boring,5
2,229,Love <>,5
143,11,"very organised unit, with plenty of resources on blackboard",5
136,120,"The work division within the Unit was well organised which mean that the student was able to complete the tasks one by one as the time went by.
The responds from the teaching staffs were very helpful",5
131,3,"Real life work, real life rewards and consequences :D",5
137,527,"<> and <>.  

Without a doubt <> is one of the best lecturers at Swinburne.  He's engaging, learned, funny, passionate and he controls the classroom very well.  

<> is equally an engaging lecturer and teacher (although I only had her a few times).  

The material was intersting, but it would not have been nearly as interesting without these amazing accepting people helming it.",5
1175,166,"great amount of things learnt, good leaning gradient. is a bit difficult to catch up if you miss a few labs or tutes though.",5
143,119,great videos as a resource,5
1176,173,The design project was definitely the best part of this unit. Not only can it be very enjoyable for the students to but it is also a great method of learning and exercising their design and creativity.,5
1177,528,Would be nice if all the lectures were recorded so you can re-watch the lecture to help you study.,5
1178,86,The freedom we had to explore and research for the Major Practical,5
1179,306,Great teaching staff. Very well educated in the field with good relation to the real world.,5
1180,446,Very relative information to <> engineering.,5
139,121,"The best aspect is that we get to work with the <>, imagine and work with scenarios that may occur in the workforce. It is by far the best subject in the whole course.",5
1181,529,Not entirely sure what the best aspects are...maybe that we get to do experiments during the semester...but only 3 of them.,5
141,530,Organisation. <> enthusiasm!,5
1182,219,the organisation - the book and subject outline,5
1183,112,"Openness of content, portfolio based. Flexible lecture topics.",5
142,284,The tutes were very good to learn the content,5
1184,72,"The unit being based around one overall project outcome, and that a semester worth of work and collaboration could be seen in one final product.",5
1185,90,This was such an interesting unit! loved it,5
1186,166,<> is a legend. Very organised and very passionate about the subject material.,5
1187,298,"Unquestionably, <> was the most active and consistent person I have ever seen on Blackboard. Marked forum posts every week demands rigorously on time maintenance of the weekly topics, and it worked.

<> also did a very good job of outlining the assignment requirements better than most job applications I've seen (sorry, needed to make a weird analogy somewhere). Told me what to do from the get-go.",5
1188,19,the tutorials,5
1174,304,<> was a very enthusiastic tutor who taught the tutorials at a high level,5
1189,86,The labs were interesting and not as prescriptive as other units,5
1190,531,"Content was generally interesting, and well taught",5
1176,115,"The lectures also being used similarly to a tutorial class. Most units in my <> degree have too much time allocate to classic lectures and not enough for tutorial classes where the theory is put into practice. Most of the assessment for a unit is testing students ability to put theory into practice, not about the theory itself so for most students, tutorials are more important than the lecture. In each of the lectures, examples were not only explained but worked through which helps a lot to understand how to apply the material.",5
1191,19,Labs and Tutes with <>,5
149,219,"Providing a weekly schedule, full lecture notes etc makes what is expected of students very clear. Lectures and tutorials are effective at providing worked solutions and all the content you need. Tutors & lecturers present well and are responsive to questions.",5
149,199,"Fantastic balance of regular fortnightly assignments, in-class work, and overall assignment. Possibly the only time where in class ice-breaking/learning activities were genuinely enjoyable and useful to the content we're learning.

1 x 3hr class is definitely the best way to run it.",5
1174,7,<> was a very positive tutor who was engaging although the classes were so long,5
1192,84,i enjoyed doing the autocad,5
1193,151,"All of the work available from the beginning, weekly tasks that build upon knowledge. burn down chart. Waiting list on board for help desk.",5
1194,5,The Textbook.,5
1195,86,Rotation of team members. Gradually increasing marking scheme. No exam.,5
1194,529,The textbook is well written..,5
1196,296,"If you can construe being yelled at, confused, worried you are about to enter the legal sector not having a god damn clue about admin law as a good thing, then yes, these would be good things about this unit.",5
1192,190,its a really well set out subject. the blackboard is very helpful and the use of two online tests i found very manageable,5
147,224,Scheduling and estimating was not dissimilar to what is completed out in the workforce so this subject presenting students with schedules and whatnot is very good experience. The fact of the matter is that most students will be doing scheduling and estimating as their first job when they graduate.,5
149,126,"<> scaring the class into submission to work effectively.

In retrospect, <> demands are not unreasonable, and work very effectively in demonstrating to myself the level and quality of work that I can output if I put in the time. This carries over to <> section as well.

Kahoot's are also genuinely effective in keeping the lecture engaging.

<>, <> and <> were great at giving feedback, and were clear in what was expected of the class and assignments. There are very few units that are as clear as this one.

<> section is also useful, and works as a good supplement to the first assignment.",5
146,15,"turn one lecture into two hours' sections, more knowledge is welcome to learn from this unit.",5
1197,315,the tutorials since that <> often clarified any issues I had.,5
151,532,Everything,5
1198,70,Flexibility to explore whatever experimental avenue we liked.,5
145,150,"The best aspects is that there are two tests, which covers half of the learning materials, which means only half of the learning materials are covered in the final exam.",5
151,253,The tutor is really passionate and knows what shes talking about,5
150,18,I enjoyed each topic covered in this unit and the assignments provided a good challenge. My tutor <> was very engaging especially on a <> <> and it was always a joy to come to her class. I have had her in the past and she has improved greatly in her teaching.,5
1199,525,The wealth of knowledge of the instructor and the use of real world scenarios to demonstrate the topics.,5
151,425,the tutor and convenor are really cool and deliver well and clear,5
1200,533,I loved the different issues and interesting theories raised within a topic. I also loved how there were discussion questions at the end of the lecture. Hearing the class opinion on things really made me learn more.,5
1201,3,"I loved how this unit and the corresponding Semester 1 unit enabled students to spend a whole year putting all their skills to use in a real project. The project we had was challenging but achievable, and we were basically given free reign to organise by ourselves how it would be achieved over the year. I liked how there wasn't too many useless time-wasting aspects of the unit - for much of it there were no lectures (which are a bit of a waste of time for a subject like this).",5
1202,243,the week by week planning,5
