Student ID,Unit Number,Comments,Satisfaction
347,222,4 hours lecture a week,5
348,257,Nothing - I just wish I could get my money back for this,5
349,175,Finishing the outcomes and presenting the work to my fellow colleges.,5
350,258,The brief of this unit quite clearly.It has a  lot of details,5
351,42,"The best aspects of this unit are that it provides a strong philosophical foundation for the vocational study of Marketing, It also demonstrates a broad understanding of the major conceptual and theoretical principles upon which the practice of marketing is based. It also creates a general understanding of marketing management tasks and of how marketing fits into the organisational environment and interacts with diverse environment, its teaches to work effectively as an individual or a team member to communicate well orally or in writing.",5
352,259,experience and practical help,5
353,19,Tutorials! <> was a great tutor. He went over the lecture material and made sure we understood the topic before going on to relevant questions.,5
354,33,I actually quite liked the split major assessments. Working closely with 750 words of textual analysis while also working on a creative piece of the same length was helpful.,5
355,75,EWB section was run incredibly well. Everything about it worked. Very informative about a plethora of aspects of engineering.,5
356,8,The awesome teachers,5
354,260,<> clearly knows his stuff and is interesting to listen to (which you kind of want if we're going to be absorbing 12 weeks of information).,5
357,176,The labs were good to cement understanding of the content,5
358,27,"- Labs are very informative and comprehensive.
- Lectures are well laid out (if not a little short considering they often only last 1.5Hrs)",5
25,261,"the teacher can use some experiences to explain the knowledge, make it interesting in the class.",5
359,262,Watching films and discussing the issues surrounding them in their home country. Was interesting and eye opening.,5
360,263,"Most of the lecturers were really engaging.
It was particularly helpful when case scenarios were given.",5
361,264,Great lecturing and interesting labs. Overall a great time!,5
356,262,The wonderful teachers and the sheer amount of new information I have been taught.,5
25,265,"only eleven students enrol the class, cannot make comments on this part.",5
362,182,layout of lectures and tunes,5
355,248,The Mathematica lab was very well executed.,5
363,266,"The readings provided by <> and their apparent cohesion with one another, making for a very interesting semester",5
361,19,Despite being pretty long the labs aren't too bad.,5
356,26,The teacher :),5
27,27,the labs and learning how to code in c++,5
364,19,The tutorials with <> were good and I felt like I was learning.,5
365,33,"Learning about the different elements of writing was great, and was definitely beneficial for my own writing. The assessments were also planned well, as they meant we were able to work on both our own writing and analysing other's work and applying the theory to our practice.",5
366,172,The procedural approach culminating in our final research essays.,5
367,267,"I loved having the video links and being able to watch the videos and do the reading well in advance of the class.  It gave me the opportunity to sometimes watch the videos more than once.  I felt that I could be totally prepared as the lecture material was put up ahead of time.  Thank you.

Both <> and <> were approachable and helpful.  Again, thank you!

The course provided a wide-range of material.  It was thought provoking.  It has made me very interested in pursuing further studies related to family therapy.",5
27,28,the labs and practical work that was done in the labs,5
368,19,"i don't have many complaints, but not much praise. i guess the weighting for labs/tests/exam is a good ratio,",5
369,268,Being given the chance to work on a green screen and actually experiment with Adobe After Effects has been alright during the more hands-on times.,5
370,269,I liked being updated by Facebook constantly. It's such a great reminder as I use Facebook more than Blackboard. This unit is very realistic to future jobs we may be applying for. It was great working on audio and video reports live.,5
368,270,"the format of the tests (best 4 of 6) is ideal.  
the content was paced well.",5
371,251,The work done by the tutors in the unit was terrific. They essentially taught me this unit as the lectures were not engaging and not interesting at all.,5
372,12,Probably our tutor as she bothered to remember our names and gave useful feedback for both our presentations.,5
373,271,the subject is well organized and the new contents were interesting and useful,5
363,272,"The engaging content, the wealth of knowledge from both <> and <>, and the enormously relevance of the readings.",5
374,273,"Getting to spend time in the arcade, and in the bunker, where we can concentrate on getting our work done and focus as a team",5
375,274,The tricks i learnt for Solidworks modeling!,5
26,172,Delivery of content and discourse,5
376,220,"The tutes, although they are barely long enough to get through a few questions.",5
28,275,"This unit covers many different techniques in editing and video composition, building on everything that has been taught in previous units. Ample time is given to research and decide on a film for the final project, and plenty of time and assistance is given to completing said final product.",5
377,162,"I have very much enjoyed the learning content of this unit, it has furthered my knowledge and understanding of sustainable design in a consturction sense as last semesters <> was more conceptual but still very informative.",5
378,228,"Activism topic was interesting and i enjoyed learning about this, I liked the tutorial questions and working as a team each week.",5
379,202,Being able to work directly with real-world industry clients.,5
380,273,"- Being able to showcase a year's hard work at PAX to hundreds of people. It was amazing to have so many people come through and play the games, have fun, and bring their friends along for more fun because they enjoyed it so much the first time. It provided a taste of what's to come if we pursue a career in games.
- Having the Bunker as a workspace 5 hours a week. It was great to have somewhere outside the classroom to meet with teammates and organise the project.
- Having the Arcade as a workspace 5 hours a week. Same as above but with the added bonus of talking with the other developers who work there and being able to meet and get advice from people in the industry.
- Guest lecturers at the Arcade. As mentioned above, it's great being able to hear opinions of people from various parts of the game industry.",5
381,257,"The best aspect of this unit was the lecture content, most of it was quite informative and it was all new information that hadn't been delivered in previous units.",5
382,156,Get speakers in lectures were relevant.,5
383,276,"I liked the brief, it was good that it was current, plenty of research to back up claims made but just needed to be more refined in the way it was too broad.",5
384,162,<> is a great lecturer and course coordinator.,5
379,63,"The unit was really well organised, all content was relevant, the tests covered the content accurately and I really enjoyed the flexibility of being able to do some tests online.",5
385,277,"The weekly content on Blackboard was very good. There is seriously so much useful information on there and fully prepares us for the week ahead, what we should expect and how it is going to benefit us.",5
386,25,"I thoroughly enjoyed this unit, my favourite task was probably either the Light task or the colour task, I have enjoyed making my photobook as well.",5
387,257,"The goals part was helpful- the readings actually helped me understand how to determine my goals, why these goals are important to me and consider how I might achieve these. It was also great to define our idea of success. It was interesting to read others responses. I think we had a decent class and most people seemed comfortable actually having discussions. I also liked the powerpoint presentations that you download and listen to- there were a couple which I found very valuable. Some content included information I was already familiar with however, it was good to have it outlined clearly and with sophistication.",5
388,106,I think the best part is the one to one tutorial.,5
28,278,"The freedom in what to choose to do was greatly appreciated, as well as the alternative provided for those who wanted more structure.",5
389,16,The thoroughness of the lectures and echo center,5
382,279,After three years of study at Swinburne it was finally a unit that actually taught how to use photoshop instead of just giving you a brief and marking you on what you already know.,5
377,257,"I think that aspects of this unit very very informative and useful. I especially liked the presentations by <> and <>, as these were the most 'real' and useful parts of helping to sell/ brand yourself for future workplaces.",5
390,213,The Industry Placement,5
391,280,"The Checkpoints and how <> kept on top of our progress, making sure we didn't fall behind.",5
392,163,The projects themselves,5
393,246,"The first assignment, and its brief, were VERY well developed and concise. Future assignments should be modeled off this example.
The lectures were engaging and interesting.",5
394,73,Thought provoking data,5
395,281,I think it was clearly explained from the beginning of the semester what was expected from each task and this didn't change over the semester. It's nice that it's all only electronic submissions as it saves us students money on printing.,5
396,8,The amount of talk about superheroes and disney.,5
397,150,"Applied theory in the labs. The theory itself was very interesting and detailed, and delivered with an exceptional standard.",5
393,60,The first assignment. Definitely the best prepared and most concise.,5
398,95,can improve the capability of public speech,5
399,19,laboratory report,5
400,128,it should have two hours lecture the two hours of lab,5
401,11,assessment is interesting for me,5
402,282,It didn't start early,5
403,72,Course is well organised,5
404,283,"Everything was really clear as to what we had to do, <> put in a lot of effort using blackboard and with her slides weekly. It was easy to follow, and easy to find references and information. I also liked the shift from a lecture to a 'workshop'.",5
405,16,the unit content,5
399,222,material,5
406,284,"practical knowledge, not much calculations, focus on analysis skills",5
399,24,tutorial solution,5
407,285,Online tutorials,5
408,286,it was easy to understand,5
409,184,it is intresting its just a bid chewy,5
410,199,"I enjoy the way the classes are run, regardless",5
411,129,how easily concepts were explained. <> teaches really well and is very thorough when explaining difficult terms and concepts,5
408,11,my teacher was really understanding and patient,5
412,287,"Good communication from teacher, clearly communicate about briefs and help around student individually.",5
413,195,Guest lecturers. Great idea to keep the lectures interesting,5
414,288,"lectures were always really interesting,",5
415,289,"working together as a group, with the class and the teachers and feeling support from everyone",5
416,217,I really enjoy this unit. <> is a quite nice tutor.,5
417,290,The relevance that the topics had with current events in the world.,5
418,291,The labs and on site water sampling.,5
419,292,Ajax technique,5
420,293,Everything <> did,5
416,162,we can learn a lot of professional knowledge about architecture structure.,5
414,48,tutorials,5
414,139,The lab report was really interesting and enjoyable,5
421,262,"It was really good and the best unit i've had so far. <> and <> lectures were very well written. broad yet concise, engaging, informative and most of all it was really inspiring. I was becoming a little disillusioned with Swinburne Screen Studies, where it was focusing its energy and how it was engaging and providing relevance to students interested in Cinema (so much seemed to be focused blockbusters, TV, animation and video games). But this unit has really helped in motivating me to continue here.",5
420,294,How helpful it will be in my career,5
422,113,Getting networks to work is actually fun when youre not stressed about failing an exam with one mistake.,5
423,295,The balance between practical and theoretical content in the course and the way it follows through from <>.,5
424,163,The projects were good to learn about spot colours and CMYK printing,5
425,296,"Problem solving seminars, however, I would prefer if we did not always have to work in groups.",5
426,297,<>. She is very knowledgeable and helpful.,5
427,12,Wiki part,5
428,296,<> was energetic and enthusiastic throughout the course of the unit.,5
429,123,Pitching to <> :),5
430,298,"Blackboard Discussions
Major Assignment Topic Selection Criteria",5
431,299,Great mix of students from diverse background and many currently working full time. This allowed for great class discussion and allowing varied views from working students and international students.,5
432,300,The presentation,5
433,147,"extremely well organised, fantastic content, highly ethical and inspirational lecturer",5
434,137,The content was good on a general level and <> the lecturer was happy to explain things in detail if anyone had a question,5
435,301,drinking water distribution lab .,5
436,302,Assessment.,5
437,303,"1st = <> detailed explanation and reinforcing style (explains concept, then asks us questions and tells us to write it down if we don't know the answer - even as adult learners it is good to have strong guidance sometime) are presented in a logical, orderly manner that facilitates deep understanding of each concept and just how the jigsaw puzzle of human physiology all works together. 

2nd = Weekly tests keep us from falling behind (which is vital with such an large learning content) and show us just where we need to refocus our study. The 2 attempts for each test, with the second attempt offering slightly different questions really pushes us to know our content. If the lab test was somehow combined with the content test, and pushed out to be a fortnightly test this may have reduced some pressure to keep up to date, but my experience in other units of constantly having to double check if something is on this week or not and the ever present anxiety that I may muck up my weeks and miss a test, is completely removed in this unit by having a weekly test of one sort or another. I found it so much easier to just know ""right, let's get this week's test done"", even with a rather traumatic semester (as I had this semester) I preferred to have a weekly commitment. My units that didn't have such a weekly demand, I found I either accidentally mucked up and missed a test (or 2!! and I have well organised spreadsheets designed to prevent that, but that failed me in times of great stress!), or for those without any tests, I didn't committed enough time consistently throughout the semester to keep up to date, and now at week 12, I have a mountain ahead of me.

3rd = Pracs/Labs were so interesting and relevant to the unit topics, really reinforcing our learning, taking it from theory to operationalised understanding.",5
438,117,Tutorials,5
439,283,motivating students to came out with great problems and solutions,5
439,72,the best thing about this unit was about how this unit helps us to get an experience to work with other from different department as well as to teach how we open up a new business.,5
440,304,the assessment were well organised.,5
31,305,more tutorial time,5
31,207,new concept to learn,5
31,277,interesting stuff to learn about,5
440,306,the teachers were really good with the explanation of the concepts and by taking different examples to explain regrading the course.,5
441,54,Extra tasks for people who wish to do more.,5
442,290,The weekly news Padlet,5
443,307,the teacher was so helpful and she was made the class fun,5
443,308,the assessments were straight forward,5
443,225,the teacher,5
444,309,"Learning about lighting and green screen techniques, using the Cannon 5D. I was a little afraid of this subject at first but now love it!",5
445,66,Learning the evolutions of popular technology was really fun,5
446,286,Theory will explained.,5
447,310,I like the topic,5
448,32,<> is epic.,5
32,309,Can't be bothered with this. Busy.,5
449,21,practicals,5
450,21,- Learning about real life situations in construction.,5
451,95,The client was interesting.,5
452,221,theories,5
453,311,Discussion and activities in class.,5
454,312,good,5
455,11,good,5
455,313,good,5
456,12,Lectures,5
455,314,good,5
457,315,"Individual presentations are pretty challenging, but that's really good for us to increase our skills in all aspects.",5
455,316,good,5
457,317,Every week in class activities are so helpful and very effective for us to renew our knowledge about the lesson.,5
458,244,The tutorials. Siamak is very good.,5
459,318,<> were trying to answer and figure out whenever students ask questions to give best answers.,5
459,226,pratice Art in the class by some of materials,5
460,34,The practical sides are extremely good.,5
459,319,lots of discussion with others and finding real answer throughout the class,5
460,54,There are no best aspects in this unit,5
461,320,"The theme, it is excellent",5
462,321,Then content we learn through out the unit.,5
463,168,freedom to explore ideas and act creatively,5
464,322,practice and reality are the best aspects of this unit. i did alot of work and had a lot of real experiences as well as theory.,5
33,304,presentation,5
465,323,Everything aviation,5
466,324,Being able to spend so much time in class coding and following tutorials was good.,5
467,200,How well laid out all the weekly information was on blackboard and how easy to obtain it all was with only a little bit of help. The creative freedom was also very exciting and fun to work with.,5
468,248,all good.,5
469,258,The lectures have been really interesting and valuable in helping completing the assignments.,5
33,316,group,5
470,325,Practicals were very insightful.,5
471,231,"Having the weekly in class presentations, really",5
34,326,"The current, statistical and informative videos and readings.",5
34,26,"All of it! I looked forward to the lecture/tutorial every week. <> incorporated a combination of open discussion, team and individual exercises, as well as informative videos and reading materials.",5
472,42,Volume of quality information the conceptual analysis provided within lecture and tutorial slides,5
473,327,"I enjoyed the book that was recommended, and the guest speakers for the lectures.",5
474,225,"My teacher is extremely extremely good. one of my best teachers in Swinburne. The other literacy units that I took are only alright. But I found this unit really enjoyable. I actually find literacy more inspiring than before. the assessment really relevant. teacher was extremely helpful, informative and considerate. she explained everything really clearly and I understood exactly what to do. really looking forward to have class with <> again.",5
475,226,"The best aspect of this unit is that it gives me a lot ideas and knowledge about what art actually is, and how to teach it to children in early childhood.",5
476,226,The learning materials,5
477,328,"The excursion to Bialik was absolutely amazing and it was so beneficial to see a wonderful centre working so effectively with a philosophy such as reggio.
More excursions would be a wonderful learning experience.",5
478,255,<>! I am doing this unit because I loved his <> unit. Top lecturer. Great tutor. Super smart legend!,5
479,227,"Having <> as the teacher of the unit. Her knowledge for the topics covered was extensive. She was able to really help us gain an in-depth understanding on different topics, problems, policies to do with teaching in a primary school setting.",5
480,307,"group discussions were encouraged and allowed ideas to be shared by all, a great way to learn.",5
481,329,Overall the teaching was quite good and felt quite personal.,5
481,330,Tutorials were very helpful regarding using the modeling software.,5
482,331,ron,5
483,332,"Have Tuesday mornings off.
Once class we had  <> (I think her name is), she was great!",5
484,125,"Definitely kahoot, really enjoyed and looked forward to it.",5
479,307,<> supportive and friendly nature in class.,5
478,333,"I really enjoyed the lectures. However, the lecture slides by themselves were a challenge at times.",5
485,101,"<> has clear expectations which are made explicit. Notes are comprehensive, and feedback is insightful and provided in a timely manner.",5
486,7,The class discussion,5
487,334,Helpful tutorials.,5
488,258,The first 2 projects.,5
489,149,all of it,5
485,335,Workshops are very informative and relate explicitly to the content. Good setup for professional experience.,5
490,34,The tutor did solid job  in his explanations of the topics convered in the lecture before beginning,5
491,80,Having screen presentations throughout the unit was useful to see what everyone was doing and how they were doing it. It provided inspiration and often answered any concerns I had through seeing what other people did and hearing feedback.,5
492,336,"Breaking up all the assignments into small groups throughout the semester, as opposed to only a few major assignments.",5
493,255,"The lectures, they are really fascinating and in depth. Although sometimes it feels like it goes over my head. But it is still amazing stuff.",5
494,337,"Feedback, Avid lessons, Davinci resolve",5
495,338,The overall unit is very interesting and well thought out.,5
496,14,The tutorials and Civil 3D classes.,5
486,304,The assessments,5
497,11,the assignment being split into three sections rather than one overwhelming assignment,5
497,339,assignment 2,5
498,132,AWS technologies were good to know,5
499,340,The tutorial discussions,5
500,136,I think the assessments are useful and practical. They assess what needs to be assessed but also teach us skills that we will use in the future. They're also nicely spread out through the semester,5
501,341,Fieldwork and equipment that can be used,5
502,342,Applying the knowledge in practical classes,5
497,23,the organised assignments and their early submissions before week 12,5
497,32,the lecture materials and explanations,5
503,59,Generally interesting lectures. <> was a funny lecturer that provided entertainment with her anecdotal stories,5
504,32,The unit was comprehensive in all market research facets.,5
505,11,consultation times are good and the online videos helped a lot,5
506,33,Work-shopping creative piece in class.,5
507,343,My tutor <> was amazing!!!,5
508,8,"The lectures were surprisingly enjoyable, and I actually found that I enjoyed going to them.",5
509,24,"Helpful questions on blackboard towards end of semester, Labs.",5
509,19,Tutorials,5
510,19,The labs were quite interesting. Very helpful in consolidating most of the theory covered in the lectures.,5
511,26,"The actual theoretical sections when discussion actually occurred
.",5
512,344,The lecturer’s organisation of material and classroom time.,5
513,26,"Blackboard is well organised and easy to navigate for this unit. The three hour class is perfect for fitting in everything for the week - as well as the folio pieces, which students would usually have to do in their own time at home. I like having the whole week fit into one three hour class, rather than spread out into tutorials and lectures. The content is interesting, as well as how practical the work is. In this class, students actually get a chance and good incentive to write and write.",5
496,325,The tutorials,5
514,258,exploring outside of the box thinking,5
515,116,"was able to study more about the real world scenarios, specially through the case studies each week and also with the presentation.",5
516,116,good,5
517,345,Tutorials were pretty well done. Lectures are also well structured and we get through them pretty quickly. The recap on the previous weeks lecture is also nice.,5
518,14,"it is an interesting and 'practical' subject, I like units were we get to work with CAD",5
519,205,"The lecture is really inspiring with a lots of real scenario example, story, application, etc.
Lab part is also really good",5
520,133,"- content was interesting 
- convenor is friendly and flexible
- emails back quick",5
521,346,Everything seems fine,5
522,347,Getting to see the usability lab.,5
523,348,"The hands on practical knowledge and the in-depth knowledge from our tutors who work in the field was invaluable. I loved using industry standard, Logic and the recording booth.",5
524,200,The creation of a booklet in 6 weeks really pushed and challenged me in a good way. I liked how the two assignments were related and how the second assignment was a continuation and transposing print into digital.,5
525,8,The lectures which weren't taught by <>.,5
526,111,Give exam related materials to read. Give previous exam papers to understand the pattern of exams.,5
527,349,Blackboard information was good however rarely punctual.,5
524,350,"The lectures were very engaging, the tutorials were useful and the assignments actually reflected on what was being taught in lectures and tutorials. I loved all the group work and felt there was just the right amount of work involved in the unit.",5
496,234,The tutorials,5
520,139,"- effective tutorials 
- detailed assignment sheet",5
528,113,Labs,5
