Student ID,Unit Number,Comments,Satisfaction
1,1,This unit is very helpful and informative on topics we haven't previously touched on,5
2,2,"Nothing, waste of time... it is easier just to read the books",5
3,3,"Our supervisor. <> was very responsive, supportive and provided the clarity we needed throughout our assessment.",5
4,4,Having Echo is very helpful for the times that I am unable to attend lectures.,5
5,5,Well structured,5
6,6,"Lecture content, particulary week <> gave about crime and violence/guns as was a hard week in the media and she gave great explanation of gun violence",5
7,1,it was well organised and allowed you to think about what it would be like if you ran your own company,5
8,7,having a video record for this unit is necessary,5
9,8,The concepts of the unit,5
10,9,I appreciate that having the weekly questions to submit really helps with preparation prior to the in class discussion and I feel as though you get more from the subject when you research before the class and can contribute your ideas confidently.,5
11,10,"A very honest, realistic and relevant summary of the main areas and major critiques of <>. <> is massively engaging and <> is super organised and so level-headed - what a great team",5
12,11,The knowledge and examples used to demonstrate the theory content of the course.,5
13,10,"<> understanding and presentation of the material in a sophisticated, but understandle way.",5
14,12,The wiki page was great as you could see the work of other students and compare it with what we had done.,5
15,13,"<>, shes a great tutor",5
16,14,The practical use of <> and <> help usually with explanation which were thorough,5
17,15,<> was by far one of the best teachers I've had at Swinburne. <> was always enthusiastic and looking to engage the students in discussion.  One thing I enjoyed most about this unit was the freedom we had to explore the various topics.,5
18,16,The movies chosen had a great range and depending on the genre of the week it was easy to learn,5
19,17,lectures are sort of good. Definitely better than the previous convener,5
20,10,The content was fascinating.,5
21,18,"Overall pretty good unit, pretty good lectures ect",5
22,19,Labs. But instructors need to be more prepared to answer questions.,5
23,20,"The project in  which we made our own comic and wrote a reflective essay, and the workshop class with <> was fantastic (so were all other interactions with people from the industry)",5
24,21,all good,5
25,22,students can have too much time to discuss with the teacher.,5
26,23,Useful knowledge for technology in real life,5
27,24,doing the labs and practical work in the labs,5
28,25,"The numerous techniques covered by the tutorials, focusing on all the basics of photography such as lighting, movement, scale and colour.",5
29,26,"I really enjoyed this unit overall. I enjoyed the creative freedom and found that it was a good environment to discuss ideas without judgement or negativity. 
I felt supported as a learner and also a writer.",5
30,27,"<> is incredibly good at what <> does, very happy with <> tutelage.",5
30,28,"Lectures are incredibly well put together. Content heavy but every page is necessary, cannot appreciate that enough. All teachers also seemed excited about what they were doing, which helped a lot.",5
31,29,Interesting topics,5
32,30,"Teacher is nice and does give some good one on one advice. However, lectures are useless and not helpful, as well as everything else in this unit. And - NO TECHNICAL HELP.",5
33,11,Lecturer,5
34,31,"The videos, open discussions, group activities and <> encouragement and support.",5
35,32,The practical examples used in class,5
36,32,"I really enjoyed the practical side of the labs of learning how to do some statistics and I found it to be enjoyable and helpful. In class, <> tried to make it as enjoyable as he can for us also which I appreciate.",5
37,33,"Work-shopping in class is always a great way to get feedback from both the tutor and peers. Lectures are always packed with content, demonstrating all the possible things you can focus on in the text analysis.",5
38,34,the scenarios and <> charm and raw charisma,5
39,35,"<> is a very knowledgeable and helpful tutor, who ensures that each student understands the content of this unit extremely well.",5
40,36,Personally I would like to see this unit completely restructured.,5
41,37,The content and topics.,5
42,38,"Good enough, help us to develop real project with industry view and skill.",5
43,8,"This is probably my favourite class this semester. I really like the structure, dividing the course into the two sections, I think it works really effectively. I also just loved the content and the use of examples throughout the lectures.",5
44,39,The freedom of working digitally was a benefit as it helped us complete work at our own pace whilst still meeting deadlines.,5
45,22,I enjoyed the interactive approach the facilitator used to make the class more lively and encourage people to share their views and understanding of the concepts. It was an enriching atmosphere despite the 3 hours sessions - it was never boring or tiring as time was used well in teaching and discussion.,5
46,40,"<> teaching is great, and the experience of shooting 16mm is absolutely unbeatable. This class was amazing and the opportunity to use film was so so so valuable. Loved this class",5
47,8,"The lectures, and learning about adaptation processes and how the film industry is changing to revolve around trans media franchises. The tutorial discussions were also informative and lots of fun.",5
48,41,talking on the same level with the teachers,5
49,42,"The first group assignment was good, although my group found it hard to keep up stamina for the second.",5
50,21,tutorial classes. tutorial questions.,5
51,26,The use of video interviews was fantastic. It gave us the opportunity to listen to how they talk and the natural way they tell their stories.,5
52,43,"Interesting, lots of hand on work.",5
53,44,The  weekly feedback and the assessment feedback,5
54,45,The online tests,5
55,27,I found the structure of the course work really helpful and refreshing. Having the important tutorial tasks get submitted and marked with the assignment tasks is far better than a portfolio set-up as it forces students to be up-to-date and motivates them to work well as their work gets marked. This structure worked very well for my learning style and im assuming most students did very well in this unit as most programming units haven't actually thought about the best structure for the students they choose the most logical way but also a way that makes their marking job the easiest.,5
56,46,labs.,5
56,47,Labs and <> was good in teaching.,5
57,48,"Tutorial times were used effectively, where the class was encouraged to lead discussion and friendly debate. <> steps back enough to allow the class to conduct it's own discussion but also has complete control of the space as well, and contributes her own honest opinions which is very helpful.",5
58,49,We can practice and do a practical project.,5
59,50,Lecturer <> is very experienced and kind. Tutor <> is very very responsible and encouraging with students!,5
60,12,<> lectures where very engaging and interesting,5
61,25,"The final project of design the photo book was by far the most enjoyable part of the unit, and the only real time I learnt how photography works with design.",5
62,51,Communication between teacher/student and relevant information,5
63,52,The best aspects were the relatively open scope when completing assessments.,5
64,53,"Appreciate the effort of constructing the lecture slides. They were really nice and mostly understandable. Content was great. Full on though!
Practicals were very interesting, I liked the TBI experiment and evoked potentials as it was hands on.
Many people had problems with the due dates, very appreciated that many extensions were given. To avoid as many extensions for students taking the unit in the future: simpler is often better, assessment guides could seem overwhelming to some students. Regular check-in with students at the start of lectures to avoid frustration. Better communication among teaching staff, as well as being more present on blackboard.",5
65,54,Lectures and labs were well organised and each topic was explained deeply in each type of class mode with examples from few similar tasks. It was very organised and we were able to keep track of how we are going in tasks with reminders from lecturer in blackboard. Help desk was extremely beneficial and the tutors there were really helpful and guided me with calmness. Weekly videos were also a major help when struggling with challenging tasks so that was really helpful.,5
66,40,Still getting to use 16mm in this day and age.,5
67,55,"The straightforward content, the tutors.",5
68,56,4 hours of lectures is a good amount of time to be able to learn everything. Tutorial questions are relevant.,5
69,57,"Fascinating subject matter, I love <>  lectures. he is so interesting to listen to and delivers the information in such a logical and easy to understand matter. His lectures are probably the best laid out and delivered of all of my units which is amazing because I feel like I get a really good grasp of the subject and am able to take really good notes as well.",5
70,25,"The colour assignment and I liked the use of Flickr, as I gained feedback on my photos through comments.",5
71,58,"The content presented in an understandable manner, the group work sheets to collaborate on ideas and engage with peers",5
71,59,The reiteration of key concepts in tutorials with practical examples,5
72,17,The clicker questions and the tutorials were the best approach towards learning.  The few physcasts that were there helped to assimilate the information very well.  The labs were well-designed and very integrated with the content - I should have chose the 'odd number' weeks because doing the labs on the even weeks meant that I missed out on the relevant information on the week it was presented.,5
73,60,the project of creating a board game prototype,5
74,61,<> clearly sets out the process of answering problem questions.,5
75,62,Learning provides sufficient resources for students to help them improve with their studies.,5
76,63,"*Practising in the lecture 
*The online test, it was letting me to study topic per topic 
*The unit in general is interesting and I really enjoyed it",5
77,43,tutorial activities,5
78,64,"there was nothing related to design field, we were just talking about aboriginals.",5
79,65,"I strongly disappointing on how this unit programmed/organized.  As a international student i traveled all the way to here to learn some new skills and develop knowledge. however, this unit is conducted on online based classes.",5
80,66,clear structured examples,5
81,67,All of the content we have learned in class is extremely valuable. I have already used the skills I have learned this semester in production management on short film shoots and my organisation and communication during production has already improved. The lessons are well-structured so that we have class time to work on our group assignments which takes pressure off of trying to organise a group together outside of class.,5
82,68,Lectures often compressed the examined content into the first hour so we could all leave early.,5
78,65,I did not liked it at all. As I learned nothing out of this unit. Plus the outline is so confusing and no teaching session made it more difficult.,5
83,69,The visual aids and the computer programs like MDsolids really helps with cementing understanding.,5
84,70,The option to explore new forms of media in Assignment 2.,5
85,15,it is well explained and i like the teaching.,5
86,71,teaching method is superb,5
87,63,"I really enjoyed the teachers both <> and <>. 

<> was great to get to know, and <> was very thorough in her teaching.",5
88,42,The way <> presented the topic and is never ending urge to help me,5
89,72,the teacher can fix our report problem and give useful suggestions,5
90,73,<> tuts.,5
91,74,The way my teacher revised the topics and explained it to me.,5
92,75,Group assessment to meet new people,5
93,76,Teacher's understanding and support throughout the project,5
94,77,"I enjoyed doing more assessments, compared to less in my other ones. It is more work, but it is more fair and I think that was a great idea.",5
92,78,Tutes,5
95,75,"Uh..nothing? Drawing is okay, but we're not artists..

<> was the only helpful tutor - give this girl a medal!",5
96,79,The lab videos were interesting.,5
97,80,Love this unit! <> is the best teacher I've ever had.,5
98,81,Topics covered,5
99,82,The guest speakers. The variety of lecturers to add different perspectives.,5
100,83,<> continuous support in the project. <> support material like videos and books that help us in the diagramming and creation process.,5
101,78,Cooperation with the teachers and feedback on ways to improve.,5
102,84,"lectures very engaging, <> has excellent way of describing things",5
103,85,"how we can improve our ways into conserve energy, and come up with other products.",5
104,41,"<> enthusiasm and genuine interest in seeing us learn the prototyping process was a refreshing change. A lot of the lecturers and conveners we get in this University just do not care. <> gave his all in this unit, and the content was better because of it. 10/10 unit, would take it again.",5
105,86,Getting hands on experience working on a project with the help of the teachers is a great setting to learn this.,5
106,87,"In my personal opinion, the excel spreadsheets was the best facet of this particular <>. Having the capability to use spreadsheets for financial analysis adds value to my professional/personal development, respectfully. 

Moreover, the <> assignment was certainly challenging - took up a hefty amount of time. However, I did gain valuable insight in regards to the capital market – IPOs and trading shares.",5
107,88,Including many areas,5
108,89,"<> is so passionate about <>and it's contagious. Not to mention he's a top lecturer, which unfortunately lead to my other ones this semester seeming quite pale by comparison. Or the other tutors, since I was lucky enough to be in his labs. He keeps things fun, relevant and oh so interesting.

Also the labs are really well written. )b",5
109,90,Information and delivery of the lectures and flexibility within the tutes to explore different concepts and opinions arising from lecture and reading content.,5
108,91,It's nice to get my 'hands dirty' again and have a unit with lots of coding involved.,5
110,92,The Laboratories. I found that a majority of my understanding of the content was from taking what I'd learnt in lectures and solidifying it with writing a Laboratory report.,5
111,93,Excellent lecturer.,5
112,94,The video's were good and the support resources,5
113,95,the amounf of pracstise prensetions and feedback for big report.,5
114,18,The information on the topic of <> is very interesting.,5
115,95,"My favourite aspect of this unit was the partnership with The Big Issue, and developing a social enterprise for an organisation which my values are aligned with. It allowed creative freedom and I thoroughly enjoyed being involved in The Big Idea.",5
116,96,"Exposure to a wide range of areas in psychology. I was not aware of most of the topic areas included in the weekly presentations, and being exposed to all the areas made me appreciate the possibilities for psychologists, either in post-graduate studies or in the field.",5
117,97,"I found that I knew a lot of the content from other <> units. <> felt like a refresher of everything I had studied previously, which made it easy and enjoyable as a final semester unit.",5
118,98,<>  enthusiastic and energetic teaching! He has pushed the class to think like marketers and not students doing a marketing assignment. I have learnt a lot from this class and <> teaching.,5
119,99,... exploring the Cold War in a completely different perspective than covered in<>. Given the pace and complexity of the Cold War each country could fill a units worth of content; I really enjoyed the balance struck between studying European and wider Asiatic Cold War confrontations / developments.,5
120,74,the constant examples made it easier to learn,5
117,100,"<> is a great tutor who reakky cares about her students, I think she was the best aspect of the unit.",5
121,101,"Having actual moderation and assessing practice, rather than just theoretical delivery",5
122,70,"As much as this unit can be so stressful due to being thrown into unfamiliar territory, I do enjoy the uniqueness of the projects. I've never worked on installations before, and this project terrified me of failing it. But it has helped me to really stretch my creativeness into the films.",5
123,102,The group assignment enables us to be creative and further improve our teamwork skills.,5
123,7,"Tute labs; everything is taught and practiced in the same class.
Support for class topics and assignments are well done.",5
124,103,"This unit is one of the best units for any student to do!
It teaches us many key aspects to any project and that is how to deal with the client and dealing with issues you encounter.
It also makes you feel really good when you get the finished product at the end, and see where all your hard work has gone to!",5
125,104,Learning how to render in the digital space,5
126,105,The research of neglected topic and target audience. It can wider the perspective view of design project. More experience of design research of the issue funeral.,5
127,106,"Freedom in brief. Finally a decent chance to do what we want and showcase a lengthy project in depth (semester 1+2)
Individual appointments.
Flexibility in deliverables and brief writing.
Lack of lectures towards the end (would be unnecessary)",5
128,94,"Despite my suggestion of improvement, I overall enjoyed the unit.",5
129,35,<>  help was probably the best part. Although the content seemed quite rushed through the semester. He helped in any way he could.,5
130,107,Screenings. Consultations. Learning from the lecturers' personal experiences.,5
1,108,The freedom in topic choices is great,5
131,109,assessments are welll organised,5
132,12,wiki,5
133,110,"The best aspect was the guest lecturers, and they weren't even always on topic with deployment and evolution. It was just interested to get their professional opinions on things.",5
134,109,"Really interesting being able to code graphics and create effectively something, in this case a robot, out of nothing.",5
135,110,"Guest lectures and usage of modern tools (Continuous deployment using Azure would get you bonus points though). Most subjects use old tech, so I was impressed to see a relatively recent service.",5
133,3,It was nice how much freedom they gave us just to work on our projects and how they treated us as equals.,5
136,111,Learning how to use a new software was good,5
131,112,"The approach ability of the teachers. They are all very helpful, because sometimes I go toother labs and the tutors dont mind",5
137,110,"The guest lectures were highly engaging, interesting and I felt rewarding to go to, despite the lack of relevence to the unit.",5
131,113,Lab work is relevant for the skills exam,5
137,3,Great experience.  Project management is hard.  I learnt I don't want to do it.,5
138,114,I think the unit contained interesting content and the lectures were informative. The use of videos and guest lectures was great.,5
139,115,"It was insightful, and went into the nitty gritty of it all",5
138,116,The discussion had in the tutorials was very robust and we were able to discuss a variety of issues and concepts.,5
133,117,The lectures were very well structured and easy to follow.,5
132,118,the project,5
140,119,"The online tutorials are really helpful- allowing you to complete the weekly tasks at your own pace, and go back, review and fully grasp concepts.",5
135,3,The staff. They made what they could out of a bad situation. The freedom to develop what I wanted was also great.  The unit is brilliant when it's given the resources it needs.,5
141,120,Using the workshop and documenting/making prototypes.,5
142,121,Help and advice in the labs was good and the lectures were done really well. going through the examples in the lectures helped maintain an understanding of how everything works instead of leaving you to catch up if something didnt make sense.,5
143,122,industry focused material,5
144,123,interacting with my group members as we offered each other support as there was no support provided by the tutor.,5
145,124,"The online quizzes, also leaving the quizzes open till the end of semester.",5
146,125,"various teaching types in tutorial class, hope this will continue in the future.",5
147,126,My quality of writing increased due to this subject. The conceptual design project was somewhat interesting but did feel a bit rushed.,5
148,127,Interesting topics and relatively well organised and set out,5
149,128,"The quality of information provided (lecture slides, sample exams etc) were very useful.",5
150,129,I absolutely loved coming to class each an every week. It was always engaging and presented in a way that allowed for an extensive understanding of the content. I enjoyed the challenge of the assignment which was something completely out of my comfort zone. It allowed me to apply my knowledge in a different way and learn a new area of <>,5
151,130,basic maths revision,5
152,131,The occasional one-on-one feedback was quite helpful.,5
153,132,The assignments were enjoyable and challenging. I enjoyed being able to work on them at my own pace (when possible!),5
154,10,The seminar format was excellent! Interactive discussion was invaluable to understanding the content and gave the possibility for a change of perspective on mental illness and the way in which one should engage with people in the professional and human context,5
155,133,Each topic was interesting and and made you think,5
156,134,"Our mentor tried to assist us, but even she did not have the information we needed if it was related to the courses structure or detailed assessment instructions until it was too late.",5
154,18,"Interesting marterial, interesting and engaging assignment topic (particularly assignments 2).",5
157,31,The teachers,5
158,135,"The lectures were interesting. My favourite lectures was the cosmopolitanism one and <> lecture on her experience in Saudi Arabia. I remember after watching the Global Citizen video during the lecture, I immediately felt like I had to do so much more than what I was already doing. Now I'm volunteering for the UN as a social media manager, so thank you for the eye opener.",5
158,136,The assignments and the tutorials.,5
159,137,"Overall, it is a hard subject to teach as there is a lot of content. <> tries very hard to have an interesting subject and we can see that. <> was always very nice and was great in listening to students. For the lectures there is just too much content to remember, maybe in future lectures have certain weeks dedicated to the assignment and others for learning other topics.",5
160,138,I did think the capstone project was an important learning opportunity.,5
161,139,My tutorials with <> are really informative and interesting,5
162,140,The assessments.,5
163,141,"the excursion, and all of the lecturers, they're all really interesting to listen to",5
164,10,Interactive lectures.,5
165,142,very practical,5
166,143,Content is interesting and is well presented. Lectures are interesting. Quizzes in the class are awesome and a great way to reinforce important points.,5
167,144,<> experience in knowing what has troubled students in the past. And flexibility in accommodating my busy schedule.,5
168,145,Case studies and open discussions,5
169,146,The examples used and the case studies.,5
170,147,"The case studies are most awesome part of this unit, <> selected really live cases from different industries and profession to demonstrate how strategy work, the human aspect and systematic aspect of the strategy and the how from generations to generation how strategy have been exercise by business leaders. She did not leave anything untouched include politics, culture and religions norms that affect our systematic of doing thing. 
She made great finishing today with amazing strategy game.",5
171,148,I enjoyed working with my team on the pitch and the guest speakers were great.  After completing the unit I felt a huge sense of relief but after reflection I was able to identify how much I actually learnt by being thrown in the deep end!,5
172,149,The pracs,5
172,150,The pracs,5
173,151,the easy access to resources and lecture notes,5
174,152,Interesting topics,5
174,153,"Quizes at the end of each topic to keep us on our toes, keeping it fresh in mind.",5
175,154,"friendly teacher, makes learning more easier",5
176,53,Sunday night emails! They were so good; we always felt prepared for a new week and motivated by your kind words.,5
175,155,"friendly teachers, makes learning more easy!",5
177,156,"- The open ended briefs
- A lot of room for creativity
- The similarity between the projects, allowed for a lot of refinement and a deeper understanding
- The lectures were usually really great and informative, also how they influenced the tutorials in a meaningful way",5
178,157,online accessibility for course material and lectures,5
