Student ID,Unit Number,Comments,Satisfaction
699,6,The passion of the teaching staff. Each lecture you could tell how dedicated the lectures were to <>,5
700,118,Final submission,5
701,26,Getting to read a lot of stuff and getting the chance to write a lot in class,5
702,161,"Physcasts, online assignments and great lecturers.",5
703,209,collaborating in group work,5
704,425,"Understand the influences of nature and nurture in children's oral language development. 
Learn more about different theories about language development and literacy.",5
702,141,Lectures and labs were generally pretty good. Enjoyed the enthusiasm of the teachers. The content was amazing as well.,5
705,73,The patience of the tutors and the guideline for the assignment was excellent it helped me understand the content more.,5
706,426,There're lot of useful material or tutorial being post on blackboard to help us learn more on the software,5
707,15,the student interaction as well as feedback and support from the tutors,5
706,175,"get to work in real life client, gained experience and built teamwork well",5
708,303,"WEEKLY QUIZ! 
The quiz is really good to help with the learning and revision, sometimes we don't know that such thing information exists in the lecture notes because of the huge load of content, the quiz helps to break it down and touch on stuffs that we often overlook.

<> LAB! feels like we are conducting treatment at a hospital, at the same time having ""free"" check up when we participate as subject in the experiment (e.g respiration exp)",5
709,427,Assignments,5
59,192,Lectures are very interesting to attend.,5
59,428,Tutor is very experienced and encouraging.,5
710,429,awesome,5
711,373,"Clear projects, full of important stuff that will be used in the real world, insightful teacher <>",5
712,430,Practice quizzes,5
713,12,the subject is very important for the future,5
714,431,I really enjoyed this unit. The labs were interesting. The theory led on well from 1st semester.,5
715,161,The lectures were awesome,5
716,17,"- Labs: they help understand key concepts covered in lectures
- Clicker questions: help check your understanding and keeps you concentrating during lectures",5
717,17,"The lab classes, clicker questions in lectures.",5
717,220,The tutorials were great.,5
718,69,I liked everything.,5
717,141,The content for this unit has been great. The continuous updates of what is due when has been super helpful as well.,5
719,288,The in tutorial discusions.,5
720,432,Git would be useful down the line. the effort put into teaching git was decent.,5
61,187,Learning how storyboards are constructed.,5
721,57,the discussion board,5
722,37,- Learning diverse range of topics with articles and videos.,5
723,303,The practical classes,5
723,174,The tutorials.,5
724,433,"flexibility of the unit, quizzes given",5
725,113,Practical labs,5
726,434,I think that the work we were doing once I understood it was very fun and actually using to code to control the easyveep programs I thought was a very good way to get a real visual example of what we can actually do with code. The work that was being done was honestly very intriguing and I enjoyed it a lot although sometimes the execution left me lost and confused.,5
727,16,The lectures and the films,5
728,295,"The scenarios and case study. They really help students including myself to explore old technology such as frame relay, and to successfully implement a working network using a the simulator called the packet tracer, at least.",5
729,186,<> is a great tutor and a great person :D,5
730,380,knowledge of diverse languages,5
731,392,"Enthusiasm from the teacher, the professional experience and content.",5
732,380,"assignments are really cool , it gives a lot of practical experience which helps in understanding the lecture concepts",5
733,435,Lab material and lecture which I enjoyed learning.,5
734,332,The wide variety of information covered. One of the best classes I've taken at Swinburne thus far.,5
735,151,"Fun tasks.
Good structure of content.",5
736,380,Practising weekly with lab entries as well as assignment.,5
737,366,The hands on work that is done within class,5
62,436,Communication between teacher/student,5
738,113,The skills exam having a resit... there isn't much good about networking.,5
739,334,Lecture handouts. They made the lecture easy to follow and allowed the important information to be accessible.,5
740,431,The pracs were enjoyable.,5
741,186,Most of the tasks were well written.,5
742,209,"Positives include how each lecture defined the new concepts and key terminology, then talked about the main ideas and the readings. This presentation framework was very clear and easy for me to understand.
I also liked how the lecture and the tutorial complemented each other and tied all the ideas together. I felt <> and <> were well coordinated and their teaching styles complemented each other in their separate roles in teaching this unit.
I absolutely loved that the assignment feedback was as a scored rubric. Often a general comment does not show clearly where the marks have gone and specifically where they have not. I wished all my feedback came back presented as a rubric.",5
64,334,"Well organised unit, always felt supported by the teaching staff, lots of resources to prepare for the exam (textbook, 2 practice exams, topic tests, tutorials well structured)",5
743,437,The content and the progress of the lecture is pretty free.,5
744,295,senarios are best thing,5
745,403,practical lab,5
746,334,The mastery questions that we completed together in the lectures were really helpful. The lecturers were also really engaging and determined to ensure we understand the material.,5
747,290,"Vast array of essay topics + Tutorial presentations were all interesting. Tutorial groups all very engaged each week, with lots of interesting discussion.",5
748,436,"the digital aspects of this unit and how we applied them was really enjoyable, especially the presenting of several different digital technologies that we can present within a <> environment, also the activities throughout the classroom",5
731,209,Learning and writing in a different style,5
749,48,"The lecturer and tutor, as well as the debate as an assignment, it was so open and relaxed that it created an in-depth conversation with the whole class, and everyone seemed to agreed that was valuable for learning. As well as the information provided for academic resources when writing your essay, it saved a lot of time from researching.",5
750,410,The lab is fun.,5
740,52,The excursion during the lecture was interesting.,5
751,297,The assessments were really fun. It was great to focus more on the actual creation rather than paperwork.,5
752,186,Labs. <> was an extremely good tutor who helped explain every concept in a way that was easily understood.,5
753,58,The assignments were appropriate,5
754,6,being well chunked and organised,5
740,438,I liked the calculus section of the unit. The tutorials were helpful too.,5
740,372,The pracs were enjoyable and also helped me better understand topics. I really liked the blood group testing prac.,5
755,321,the topic for the assignment was interesting and related to <>. There are clear learning objectives for each topic,5
756,321,I enjoyed the second assignment,5
757,439,A good subject matter knowledge which is useful with other networking subjects.,5
758,189,"The variety of the folios, and the assessments in general were actually enjoyable to do and research for.",5
759,155,"<> is very engaging. I like attending the tutes as she doesn't just spew out information, but rather gets us involved with questions",5
760,140,"<> is an excellent lecturer and I found her endlessly inspiring despite the somewhat dry and at times personally irrelevant subject material, and her and <> experience as <> was inspiring and helpful.",5
761,321,The tutorials. They were well designed to benefit our learning and assisted us greatly with our assignments!,5
762,440,Expert guest lecturers and weekly case studies.,5
760,441,"The effect it has had on my intellectual capabilities and understanding of the world that I live in. The way the classes and assessments are structured has such a natural and progressive feel to it, i would recommend that other conveners look to <> for ideas on how to better structure their units.",5
763,347,Having the design process last many weeks/most of the unit really helped provide an authentic feel to the process.,5
764,442,<> lectures,5
765,421,"teaching style, course organization. Relation of professor with the students.",5
738,347,The tasks are pretty easy. So are the quizzes.,5
766,441,The best aspect was learning about the early philosophers and their ideas.,5
767,443,Learning the ins and outs of the professional editing process.,5
768,358,the content and the lecturers,5
769,53,interesting content,5
770,321,Course content,5
771,330,Using new software and making it applicable to the real world.,5
772,161,intriguing.,5
771,79,"An interesting subject, with good theory and useful knowledge and skills for the outside world",5
773,444,The teacher. <> is fantastic,5
774,174,Great lecturer(s) and tutors!,5
775,303,<>. His teaching is superb.,5
776,412,"The lecturer with no doubt, legend!",5
774,334,Real-life examples and videos made <> easier to understand.,5
777,147,"<>, was particularly good at keeping group discussion going in a positive direction and on topic. She had a sense of theatre about her - where I just wanted to stay in tune.",5
778,445,Everything :),5
66,387,<> <> workshops were insightful and hands-on.,5
779,111,USING <> SOFTWARE,5
780,159,Having it well organised helps to eliminate stress for me personally.,5
781,334,"Clear structure, explained concepts very well",5
782,6,lecturer and tute teacher are both entertaining and engaging,5
783,263,The scope of disorders covered and the excellent expertise/range of presenters. Particularly <>.,5
784,321,Revision of content in tutorials was really good to review the material. Creating questions each week was also good.,5
785,56,Tutorials,5
786,446,<> is a really good teacher who has a high level of enthusiasm at all time in classes.,5
787,437,<>! he's a great teacher. i love his enthusiasm you can tell that he loves what he does and it really keeps the mood up.,5
788,189,Writing!,5
789,56,"The units content is interesting and caters to different courses that may be taking the subject, i.e <>, <>, <>, etc.",5
774,321,All the interesting topics.,5
772,118,using NI and EKG.,5
790,17,<> is really engaging,5
764,375,"Industry projects, in particular Jetstar",5
791,118,"<> was fun, overall programming as very interesting.",5
792,447,Challenging assignments,5
793,17,explanations given on topics,5
794,448,The creativity.,5
795,140,Writing exercises,5
796,449,The combination of the lecture and tutorial that complimented each other well,5
797,450,class discussions of others experiences,5
798,17,The challenges during the labs.,5
799,448,I enjoyed learning the various technique of drawing and using the <> markers. I like how we were taught step by step how to complete certain drawing methods.,5
767,140,"The lectures, specifically the one on <>.",5
800,342,The tutorials and weekly assessments.,5
68,52,Explains all the content well in the lectures and the tests are a good way to check how well we are going.,5
801,230,The unit was interesting and I did not dread the assignments as what I was learning intrigued me,5
802,55,Accounting.,5
766,371,The best aspect of this unit was looking at the Indigenous history of our nation. I was never taught this history at school and I am so glad and honoured that I was given the opportunity to learn about it in this unit.,5
803,342,Content,5
804,118,"The labs themselves, where much can be learnt.",5
805,56,Complex numbers,5
806,451,"Lectures engaging and informative
Triads taught me an amazing amount",5
807,365,Making friends,5
808,342,It's easy,5
809,365,I cannot identify a good aspect of this unit.,5
810,56,The lecture notes by the lecturer,5
811,452,Well Organized and the assignment due date is effective after covering the content and having a better understanding we submit the assignments.,5
812,118,The building of the robot,5
813,345,"I was quite disappointed with the overall unit, its structure, its blackboard system, the use of tutorial time and tutorial questions.",5
808,54,"The flexibility. Had lots of fun making small programs, but also ploughing on ahead to work on the custom project.
A good amount of support - programming help-desk, discussion board (i'm surprised people use this), swingame.com website, etc.",5
800,56,The entire module being put on Blackboard as a pdf at the start of the year. As long as it's there then it really doesn't matter if your lecturer decides to skip half the content because you can go back over it without them.,5
814,303,Interesting content,5
815,453,One on one help from the lectures and tutors,5
816,454,"engaging lectures 
no exam 
ability to choose topic that interests you for assessments",5
817,32,"<>, the lecturer is phenomenal. He is very upbeat and passionate which translates into the way he carries the lectures. I am always excited to attend the lectures and I am not afraid to ask him or any other staff member questions I may have. I think the best part about the unit are the staff.",5
818,404,I really enjoyed the weekly activities.,5
819,54,being able to complete the subject in my spare time rather than having a set limit when items are due.,5
820,45,Very Good,5
808,56,Study guide's hyperlinks (on the contents page) are actually very useful.,5
821,317,"The content was interesting, and the assignments were just as interesting.",5
790,56,The content Is interesting too bad I never went to any of my lectures because I wasn't learning.,5
822,411,Practical knowledge,5
823,347,"Interesting, its good knowledge.",5
824,365,the fact we have a quiz after each week helped me keep on track its a shame that I've studied the most for this unit when it doesn't have an exam i wish other units did this so it would encourage us to study for it more.,5
825,342,energy of the tutorial teacher and the content covered in one tutorial,5
826,174,"The assignments were really interesting, the tutorial discussions about the sexting assignment were really interesting and engaging. The research proposal was also a really practical assignment and helped me understand research methods and my future options.",5
827,342,The tutorial classes,5
828,23,Having the chance to ask the tutor questions in class when we work on certain activities.,5
829,155,The group discussions in class which really allowed the class to become close and solidify learning.,5
830,56,tutorials with <>,5
831,365,The content was made interesting through looking at success stories and examples that relate from the real world to the content learned each week.,5
832,118,The building part of the group project,5
833,135,"Relevant, up to date and interesting subject matter.",5
834,344,No text book to purchase.,5
835,141,"The lectures and tutorials. Lectures are super interesting, and the tutes are always enjoyable to attend in a way that made the work easy to understand and complete.",5
836,230,"<>, she relates real-world experience terrifically",5
837,135,Looking at different cultures when it comes to movies and representation.,5
838,144,"the unit was very well organised. The weekly tests, although a bit anxiety inducing, defiantly kept me on my toes each week so i didn't get too far behind at any given time. They were about the right level of difficulty i believe.",5
839,54,The usefulness of resources and guides,5
840,404,The portfolio aspect to the unit,5
828,365,being encouraged to speak up and voice our thoughts and opinions.,5
841,455,The way <> provided the information with examples to foster better understanding,5
842,63,the tutorials.,5
843,302,Assignment is good style,5
844,456,"Switching up lectures between <>, <>, and the guest lecturer help to keep things fresh, I particularly enjoyed the city excursion and seeing the library's special collection, I also like the online studio tutorials, in some ways I find them more useful than in-person tutes.",5
845,135,"The interesting lectures and video examples 
Learning about terrorism (and other topical things)
Doing the <> call in the week <> tutorial",5
809,457,Knowledgable teachers.,5
842,458,The online lectures. I like not having to physically go to the university.,5
846,11,The videos provided by <> on each <> topic,5
71,297,The quality time of the Labs and ability to use this time for assignments,5
847,459,main assignment,5
848,55,The online quizzes used as practice for the online test,5
849,63,Going through worksheets in the lectures was very helpful,5
846,458,The lectures are extremely helpful and easy to follow,5
850,460,Assignments,5
851,461,learning material and course is interactive,5
852,462,project work.,5
853,459,Content,5
854,463,"- Broad and clear briefs 
- Supportive teachers 
- opportunity to be creative in a variety of ways",5
855,220,That it was pretty much the same as year 12.,5
856,393,"The unit was helpful in some aspects, such as learning to use a server virtual machine.",5
857,63,"<> was a great teacher and lecturer. Very supportive, encouraging and friendly.",5
858,367,I liked the practical work we did in the tutorial (draft statement of defense),5
859,297,Applying the theory to the assignments,5
860,55,tutorials,5
843,464,Material is good.,5
861,365,The interactive side of it.,5
862,365,"I think I liked that we were forced to do something for social change, because otherwise it would be too easy. I'm glad you ditched the idea that we all had the same 3 topics and let us do our own thing. 
Kahoot was fun. Cheesy as anything, but it was fun. Kept us engaged. 
The lectures were a lot of what I consider common sense, but <> kept it engaging. 
I liked we had to do a business pitch. It was tough and I've really learnt a lot about them now. I think I could actually do one in real life if I wanted to.
<> assignment was OK, but I think you should actually have to make one and then write what you want to do in the future in the essay, rather than mocking up a template. That way, everyone will have a real LinkedIn which is useful in the long run! And they can still show they have plans on what they'd like to add.
<>, and study group was great! It was nice just having somewhere to go and talk to others in the subject. Keep it going if you can!",5
863,66,There were some thought provoking ideas and the idea of social media account managing experience was a valuable opportunity for those who were interested; great idea.,5
823,91,every bit was interesting,5
809,465,Interesting subjects covered and lecturers are very kind.,5
864,218,everything it was all very engaging and fun,5
863,466,Managed to get most students somewhat competent in using a manual camera,5
865,22,Conducting an interview and listing down the requirements as part of our assignments. It gave me practical experience about one of the roles of a <>,5
866,355,I enjoyed the communications plan assignment.,5
867,467,Assignments,5
868,11,The youtube videos,5
850,413,having a good convenor for our batch.,5
869,43,Tutorials are very organized.,5
870,468,good unit overall and relevant to my future.,5
871,460,The teaching and explanation of the related topic(s).,5
872,171,Very clear briefs - always knew what was expected of us.,5
72,52,"This course was concise, clear and gave all the information up front.  <> continued to reiterate each week what was due and how to best engage with the class.  Following his instructions made the course easier to follow than I had anticipated when I started the semester",5
873,63,The interactive lectures. Going through the questions step by step helped consolidate my learning,5
874,465,"Really friendly teachers, always willing to help",5
875,297,"Group assignments, meeting new people.",5
876,60,I really enjoyed this unit and exploring the journey to make a game.,5
877,413,Quite practical,5
878,348,"Almost everything about this unit was enjoyable, save for watching the tutor's wither under their workload.",5
879,196,Most of the pracs,5
880,171,Having individual elements that are marked which distinguish each person in the groups individual mark. Also scanning in chapters from helpful books and sources for students to easily access on blackboard.,5
823,250,"I liked the subject, it was very interesting and is very helpful. I liked almost everything about it.",5
881,231,"The broad range of topics within the unit kept the unit nice and upbeat, thus keeping me interested.",5
882,132,The small amount of  coding that we did.,5
844,365,"I like how different the unit is from other business units, and how it's more about discovering our own strengths.",5
883,400,use of Greentree tool.,5
884,66,The wide range of knowledge and expertise of <> and staff. I learnt a range of different things,5
837,297,Our group assignments.,5
844,371,The engaging lectures and stimulating tutorial discussions.,5
869,400,The concepts are pretty well presented.,5
869,261,<> has been excellent in his delivery,5
885,297,Having practical lessons,5
886,113,the early lab work,5
81,16,"<> for one! Makes every lesson extremely engaging and I feel like I learn as much as I would reading an entire book as I do listening to <> for an hour. I love the screenings in the <>, the environment is ideal for seeing films the way they are intended to be screened with beautiful sound and visuals. It also creates a good sense of community amongst the students and class discussions in tutorials are always engaging and inviting.",5
856,397,The unit is very interesting and I have learnt an astronomical amount.,5
887,469,"all the assignment helps to review subject matters well because they organized two written assignment in this unit. It well organized because it set by 1st and 2nd part of the lectures,. It helps to motivate us to do studies. So, finally we hav'nt extra pressure for the final exam. Not only that Presentation assignment improve our team work ability, presentation ability... etc.",5
843,470,Class project is good setting that can be able to prepare next topic.,5
888,471,Lecturer's knowledge in state of the the art tech is amazing. Learnt new techs and developing techs.,5
75,311,Learning provides sufficient resources for students to help them improve with their studies.,5
880,258,"The different variety of assignments we where given, none of it was the same. Also there was enough opportunities to get feedback pf work.",5
884,378,"The wide range of topics covered, especially with how relevant they are to today's society. All engaging topics.",5
889,472,<> lectures and the fact that he did a different analysis for each class and we had access to the other classes lectures.,5
890,297,The detail that was put into the lectures.,5
891,367,Content,5
892,439,TCP protocol and uses,5
76,45,"The online test very helpful because let us to study topic by topic. 
The answers that we get after the tutorial, because sometimes we don't have a lot time to solve all the questions. 
The steps to explain each part whether if excel, formula or any example was very helpful and make the unit much easy",5
71,135,Interesting range of topics covered in the lecture,5
893,473,I love the way the lecturer explaines and gives examples of IS/IT Risk Management,5
894,460,responding to the students questions,5
895,132,learning aws and getting the credit limit for trying the aws features.,5
896,16,- the range of films and the enthusiasm in my teachers,5
897,161,lectures were well organised,5
898,461,"Good intro to many different aspects of website development. Great to look at a bunch of languages and get an end to end idea of the space. 
The lab work was very well organised and explanatory to lead you into each task. Assignments do a good job of summarising it all up.",5
899,243,The classes were well structured.,5
900,67,"Every class felt like it served a purpose, and I always learnt something. Discussion was always great, and engaging.",5
901,397,Lecturer has the same name as me,5
902,67,"<> was very helpful and I learnt a lot about production management. I think that the assessment task were very useful in showing exactly what it is like to be a producer which is what the class is all about. There was a good balance of examples, theory and in class practical work.",5
80,231,case studies,5
903,439,"That there is a coding assignment. Other than that, pretty much nil.",5
904,457,"The examples provided in grammar class (Eg:""<>?? <>"")
The comprehension completed with the reading was extensive
The games in speaking class, such as the business card and the schedules. They made it so much fun.",5
905,348,"Everything. Class based units are always the best for learning and this is no exception. Everything is laid out nicely, Easy to follow and complete.",5
906,70,"The consistent feedback that is delivered in this unit is wonderful, and should be applied to all units with practical based study. I felt encouraged to pursue my ideas each time I talked to <>. The introduction of submitting to a legitimate <>, with the opportunity to be screened, is also a great learning process and very exciting.",5
899,76,"The lectures were very informative and I learnt a lot during the lectures. Norman has been a great teacher and has been very patient, and really helpful during this unit.",5
907,67,<> and her experience in the industry shining through her work.,5
908,369,the teacher and her commitment and passion for the students,5
891,61,Assignment,5
883,43,assignments and there was no exam.,5
